{
  "id": "two-column-proof-format",
  "title_ja": "証明の書き方",
  "title_en": "Two-column proof",
  "jp": "中学校学習指導要領解説（中2 証明の必要性と意味及びその方法）は、命題の「仮定」と「結論」をはっきりさせ、根拠を用いて仮定から結論を導くことを証明とし、書き方には必要以上に拘らないとする（決まった書式を示さない）。",
  "us": "CK-12 Geometry（2.15）は Given:・Prove: のあと statements と reasons を 2 列に並べる two-column proof、文章で書く paragraph proof、矢印でつなぐ flow diagram の 3 つの形を名前で呼び分ける。IM Geometry にはこれらの形の名前は出てこない。",
  "advice_ja": "CK-12 Geometry は証明の形を two-column proof・paragraph proof・flow diagram から選んでよいとするが、two-column proof では 1 行目の理由を Given と書く。授業でどの形を求められるかを確かめる。",
  "category": "proof-style",
  "level": {
    "jp": [
      "中2"
    ],
    "us": [
      "Geometry"
    ]
  },
  "term_refs": [
    "hypothesis",
    "two-column-proof",
    "paragraph-proof",
    "flowchart-proof"
  ],
  "sources": [
    {
      "type": "editorial"
    },
    {
      "type": "reference",
      "title": "中学校学習指導要領（平成29年告示）解説 数学編",
      "url": "https://www.mext.go.jp/component/a_menu/education/micro_detail/__icsFiles/afieldfile/2019/03/18/1387018_004.pdf",
      "note": "中2 B 図形: 仮定と結論、証明の書き方に拘らない"
    },
    {
      "type": "reference",
      "title": "CK-12 Geometry (K12 LibreTexts)",
      "url": "https://k12.libretexts.org/Bookshelves/Mathematics/Geometry",
      "note": "2.15 Proofs- Angle Pairs and Segments（two-column proof、paragraph proof、flow diagram、any style of proof）"
    },
    {
      "type": "reference",
      "title": "Illustrative Mathematics, IM 9–12 Math (Geometry)",
      "url": "https://im.kendallhunt.com/HS/students/2/index.html",
      "note": "証明の形の名前（two-column proof ほか）は出てこない"
    }
  ],
  "confidence": "likely",
  "updated": "2026-10-09"
}
