{
  "id": "proposition-vs-condition",
  "title_ja": "「命題」と「条件」",
  "title_en": "Statements and predicates",
  "jp": "センター試験の問題文は、変数を含む文を「実数 x に関する次の条件 p，q，r，s」と呼び（平成30年度 本試験 数学Ⅰ・数学Ａ 第1問）、条件を組み合わせた「(p かつ q) ⟹ r」などを「命題」と呼んでその真偽を問う（平成29年度 同 第1問）。共通テストも「条件 p，q を次のように定める」と書く（令和3年度 第1日程 数学Ⅰ 第1問）。",
  "us": "CK-12 Geometry は「If x = 3, then x² = 9.」のような文を conditional statement と呼び、x = 3 の部分を hypothesis、x² = 9 を conclusion と呼ぶ（2.11 If Then Statements。predicate の語は出てこない）。Levin は真偽が決まる文を statement（1.1.2 Atomic and Molecular Statements）、変数を含む文を predicate と呼び分け、P(x) と書く（1.1.3 Quantifiers and Predicates）。",
  "advice_ja": "「x に関する条件 p」は、Levin（離散数学）では predicate に当たり、P(x) と書く。高校の Geometry の if-then の文（CK-12 Geometry 2.11）では、条件にあたる部分を hypothesis（仮定）・conclusion（結論）と呼ぶ。",
  "category": "terminology",
  "level": {
    "jp": [
      "数I"
    ],
    "us": [
      "Geometry",
      "Discrete Math"
    ]
  },
  "term_refs": [
    "condition",
    "proposition",
    "predicate"
  ],
  "sources": [
    {
      "type": "editorial"
    },
    {
      "type": "reference",
      "title": "大学入試センター 平成29年度 大学入試センター試験 本試験 数学Ⅰ・数学Ａ（問題）",
      "url": "https://web.archive.org/web/20180601/https://www.dnc.ac.jp/albums/abm.php?f=abm00009412.pdf&n=%E6%95%B0%E5%AD%A6%E2%85%A0%E3%83%BB%E6%95%B0%E5%AD%A6%EF%BC%A1.pdf",
      "note": "第1問: 実数 x に関する条件 r、3 つの命題"
    },
    {
      "type": "reference",
      "title": "大学入試センター 平成30年度 大学入試センター試験 本試験 数学Ⅰ・数学Ａ（問題）",
      "url": "https://web.archive.org/web/20190601/https://www.dnc.ac.jp/albums/abm.php?f=abm00033141.pdf&n=h30+suugaku1+02suugaku1A.pdf",
      "note": "第1問: 実数 x に関する次の条件 p，q，r，s"
    },
    {
      "type": "reference",
      "title": "大学入試センター 令和3年度 大学入学共通テスト 第1日程 数学Ⅰ（問題）",
      "url": "https://web.archive.org/web/20220601/https://www.dnc.ac.jp/albums/abm.php?d=88&f=abm00001271.pdf&n=R3_%E6%95%B0%E5%AD%A6%E2%85%A0%EF%BC%88%EF%BC%91%E6%9C%8816%E6%97%A5%E3%83%BB17%E6%97%A5%EF%BC%89%E3%81%AE%E5%95%8F%E9%A1%8C.pdf",
      "note": "第1問: 条件 p，q を次のように定める"
    },
    {
      "type": "reference",
      "title": "Oscar Levin, Discrete Mathematics: An Open Introduction, 4th edition",
      "url": "https://discrete.openmathbooks.org/dmoi4.html",
      "note": "1.1.2 Atomic and Molecular Statements: statement、1.1.3 Quantifiers and Predicates: predicate、P(x)"
    },
    {
      "type": "reference",
      "title": "CK-12 Geometry (K12 LibreTexts)",
      "url": "https://k12.libretexts.org/Bookshelves/Mathematics/Geometry",
      "note": "2.11 If Then Statements: conditional statement、hypothesis、conclusion"
    }
  ],
  "confidence": "likely",
  "updated": "2026-10-09"
}
